id,tutorial_detail_id,slide,slide_user_id,slide_status,code,code_user_id,code_status,assignment,assignment_user_id,assignment_status,prerequisite_id,prerequisite_user_id,prerequisite_status,keyword,keyword_user_id,keyword_status,created,updated,additional_material,additional_material_status,additional_material_user_id
378,378,2D-Laminar-Flow-in-a-channel-Slides.zip,7,4,2D-Laminar-Flow-in-a-channel-Codefiles.zip,2149126,4,2D-Laminar-Flow-in-a-channel-Assignment.txt,2602,4,266,2602,4,"Video tutorial,CFD,laminar flow, simpleFoam, channel , OpenFoam, Meshing the geometry, Solving and post-processing results, Validation using analytic result. OpenFOAM.",1,4,2014-07-27 13:15:08,2019-10-02 02:21:55,,6,7
379,379,Turbulent-Flow-in-a-Lid-driven-Cavity-Slides.zip,7,4,Turbulent-Flow-in-a-Lid-driven-Cavity-Codefiles.zip,2149126,4,Turbulent-Flow-in-a-Lid-driven-Cavity-Assignment.txt,2602,4,378,2602,4,"Video tutorial ,CFD,Turbulent Flow in Lid driven cavity, plotting StreamLines, OpenFOAM. ",1,4,2014-07-27 13:15:08,2019-08-22 07:10:34,,6,2602
380,380,"",1,0,"",7,6,"",1,0,374,1,4,"Orca, Desktop navigation, video tutorial",7,4,2014-07-27 13:15:09,2017-04-10 11:14:39,,6,1
381,381,Xcos-Introduction-Slides.zip,7,4,"",2817,6,Xcos-Introduction-Assignment.pdf,7,4,30,1479,4,"Xcos, palette, Constructing block diagram, video tutorial,  Scilab.",1,4,2014-07-27 13:15:09,2019-12-12 10:34:16,,6,7
382,382,First-Aid-on-Fever-Slides.zip,4595,4,"",4595,6,"",4595,6,,4595,0,"Symptoms of Fever ,video tutorial, Digital divide.",1,4,2014-07-27 13:15:09,2014-07-27 13:15:09,,6,4595
383,383,Overview-and-Installation-of-PERL-Slides.zip,5485,4,Overview-and-Installation-of-PERL-Codefiles.zip,7,4,"",5485,6,,1,6,"perl overview, installing perl, perl on windows, perl on ubuntu linux, video tutorial, installation steps for perl on windows,  installation steps for perl on ubuntu-linux.",14084,4,2014-07-27 13:15:09,2019-06-11 06:17:42,,6,5485
384,384,Variables-in-Perl-Slides.zip,5485,4,"",5485,6,Variables-in-Perl-Assignment.txt,5485,4,383,5485,4,"PERL, Variables in Perl, Video Tutorial, Scalars in Perl.",1,4,2014-07-27 13:15:09,2014-07-27 13:15:58,,6,5485
385,385,Comments-in-Perl-Slides.zip,5485,4,Comments-in-Perl-Codefiles.zip,7,4,Comments-in-Perl-Assignment.txt,5485,4,384,5485,4,"PERL, Comments in Perl, Video Tutorials, Scalars in Perl.",1,4,2014-07-27 13:15:09,2019-06-11 06:18:40,,6,5485
386,386,Welcome-to-GNUKhata-Slides.zip,5373,5,"",5373,6,Welcome-to-GNUKhata-Assignment.txt,5373,5,,5373,0,video tutorial,1,0,2014-07-27 13:15:10,2015-10-05 07:18:41,,6,5373
387,387,Flow-over-a-flat-plate-Slides.zip,7,4,Flow-over-a-flat-plate-Codefiles.zip,2149126,4,Flow-over-a-flat-plate-Assignment.pdf,2602,4,379,2602,4,"Video tutorial, CFD, Flat plate, Boundary layer, glyph (vector plotting), grid spacing in meshing, Post processing results, OpenFOAM.",1,4,2014-07-27 13:15:10,2019-08-22 10:53:02,,6,2602
388,388,Simulating-Hagen-Poiseuille-flow-Slides.zip,7,4,Simulating-Hagen-Poiseuille-flow-Codefiles.zip,2149126,4,Simulating-Hagen-Poiseuille-flow-Assignment.pdf,5858,4,387,5858,4,"Video tutorial,CFD,  OpenFOAM, Creating and meshing 3D cylindrical pipe, Simulating Hagen Poiseuille,  Visualizing the velocity contour in ParaView.",1,4,2014-07-27 13:15:10,2019-08-22 10:52:38,,6,5858
389,389,for-for-each-loops-Slides.zip,5485,4,"",5485,6,for-for-each-loops-Assignment.txt,7,4,385,5485,4,"PERL, Loops in Perl, for loop in perl, foreach in perl, video tutorial.",1,4,2014-07-27 13:15:10,2018-05-17 09:39:03,,6,5485
390,390,while-do-while-loops-Slides.zip,5485,4,while-do-while-loops-Codefiles.zip,7,4,while-do-while-loops-Assignment.txt,7,4,389,5485,4,"PERL, Loops in Perl, while loop in perl, do-while loop in perl, video tutorial.",1,4,2014-07-27 13:15:10,2019-06-11 12:25:01,,6,5485
391,391,Conditional-statements-Slides.zip,5485,4,Conditional-statements-Codefiles.zip,5485,4,Conditional-statements-Assignment.txt,5485,4,384,5485,4," PERL, Conditional Statements in Perl, if statement in perl, if-else statement in perl, video tutorial. ",1,4,2014-07-27 13:15:11,2014-07-27 13:16:00,,6,5485
392,392,More-Conditional-statements-Slides.zip,5485,4,More-Conditional-statements-Codefiles.zip,7,4,More-Conditional-statements-Assignment.txt,7,4,391,5485,4,"PERL, Conditional Statements in Perl, if-elsif-else statement, switch statement, video tutorial",7,4,2014-07-27 13:15:11,2020-04-21 13:27:09,,6,5485
393,393,Account-Management-Slides.zip,5373,5,"",5373,6,Account-Management-Assignment.txt,5373,5,386,5373,4,video tutorial,1,0,2014-07-27 13:15:11,2015-10-05 07:21:45,,6,5373
394,394,File-handling-Slides.zip,6127,4,"",6127,6,"",6127,6,29,40501,4,"File Handling, writefile, read file, open file, close file, video tutorial,  Scilab.",1,4,2014-07-27 13:15:11,2017-04-18 07:35:19,,6,7
395,395,User-Defined-Input-and-Output-Slides.zip,6127,4,"",6127,6,"",6127,6,394,6127,4,"Input, mprintf, save() , load(), Formatting the output, video tutorial,  Scilab.",1,4,2014-07-27 13:15:11,2014-12-16 06:15:27,,6,6127
396,396,Integration-Slides.zip,6127,4,Integration-Codefiles.zip,7,4,"",6127,6,29,6127,4,"Integration algorithms, To divide integral into equal intervals, Calulating the composite value of the integral, video tutorial. ",7,4,2014-07-27 13:15:11,2018-06-28 04:10:42,,6,7
397,397,Solving-Non-linear-Equations-Slides.zip,6127,4,Solving-Non-linear-Equations-Codefiles.zip,6127,4,Solving-Non-linear-Equations-Assignment.pdf,7,4,29,6127,4,"Nonlinear equation using Numeriacal methods, Bisection method, Secant method, video tutorial.",7,4,2014-07-27 13:15:12,2019-12-12 10:34:06,,6,7
398,398,Linear-equations-Gaussian-Methods-Slides.zip,6127,4,Linear-equations-Gaussian-Methods-Codefiles.zip,6127,4,"",6127,6,397,6127,4,"System of linear equations, Gaussian Methods , Scilab tutorials, Video tutorial.",7,4,2014-07-27 13:15:12,2017-04-18 07:36:42,,6,7
399,399,Linear-equations-Iterative-Methods-Slides.zip,6127,4,Linear-equations-Iterative-Methods-Codefiles.zip,6127,4,Linear-equations-Iterative-Methods-Assignment.pdf,7,4,398,1,4,"System of linear equations, Iterative Methods, Scilab, Video tutorial.",7,4,2014-07-27 13:15:12,2019-04-05 09:19:11,,6,6127
400,400,Interpolation-Slides.zip,6127,4,Interpolation-Codefiles.zip,6127,4,Interpolation-Assignment.pdf,7,4,399,1,4,"Interpolation, Lagrange method, Newton Divided Difference method, Scilab, video tutorial.",7,4,2014-07-27 13:15:12,2019-12-12 10:33:33,,6,6127
401,401,ODE-Euler-methods-Slides.zip,6127,4,ODE-Euler-methods-Codefiles.zip,6127,4,ODE-Euler-methods-Assignment.pdf,7,4,400,1,4,"ODEs, Euler method, modified Euler method, video tutorial",7,4,2014-07-27 13:15:12,2019-12-12 10:33:56,,6,7
402,402,ODE-Applications-Slides.zip,6127,4,ODE-Applications-Codefiles.zip,6127,4,ODE-Applications-Assignment.pdf,7,4,401,1,4,"Scilab ODE, Examples of ODEs, Motion of simple pendulam, Van der Pol equation, Lorenz system, video tutorial. ",7,4,2014-07-27 13:15:12,2019-12-12 10:33:45,,6,6127
403,403,Optimization-Using-Karmarkar-Functions-Slides.zip,6127,4,"",6127,6,"",6127,6,402,6127,4,"Scilab, Optimization, karmarkar, video tutorial.",1,4,2014-07-27 13:15:12,2014-07-27 13:15:58,,6,6127
404,404,"",1,0,"",1,0,"",1,0,,1,0,video tutorial,1,0,2014-07-27 13:15:12,2014-07-27 13:15:12,,6,1
405,405,Digital-Signal-Processing-Slides.zip,7,4,Digital-Signal-Processing-Codefiles.zip,7,4,"",6127,6,27,40501,4,"scilab, plotting continuous and discrete sine wave, plotting step function, plotting ramp function, video tutorial, spoken tutorial",7,4,2014-07-27 13:15:12,2020-04-21 13:31:46,,6,7
406,406,"",1,0,"",1,0,"",1,0,405,1,4,video tutorial,1,0,2014-07-27 13:15:13,2014-07-27 13:16:01,,6,1
407,407,"",1,0,"",1,0,"",1,0,406,1,4,video tutorial,1,0,2014-07-27 13:15:13,2014-07-27 13:16:02,,6,1
408,408,"",1,0,"",1,0,"",1,0,407,1,4,video tutorial,1,0,2014-07-27 13:15:13,2014-07-27 13:16:02,,6,1
409,409,"",1,0,"",1,0,"",1,0,408,1,4,video tutorial,1,0,2014-07-27 13:15:13,2014-07-27 13:16:03,,6,1
410,410,Control-systems-Slides.zip,6127,4,"",6127,6,Control-systems-Assignment.pdf,7,4,15,6127,4,"Control of continuous time, Plotting  response to step and shine inputs in Scilab, Numer and denom Scilab functions, Plotting poles and zero,  video tutorial",7,4,2014-07-27 13:15:13,2019-12-12 10:33:08,,6,6127
411,411,Discrete-systems-Slides.zip,6127,4,"",6127,6,Discrete-systems-Assignment.pdf,7,4,410,6127,4,"Scilab, State space, Discrete time, video tutorial",1,4,2014-07-27 13:15:13,2019-04-05 09:15:57,,6,7
412,412,Calling-User-Defined-Functions-in-XCOS-Slides.zip,6127,4,"",6127,6,"",6127,6,381,40501,4,"video tutorial, Xcos,  Squaring function in Scilab, scifunc block, MUX block, Call functions having multiple inputs and outputs. Scilab.",1,4,2014-07-27 13:15:13,2017-01-17 06:19:05,,6,6127
413,413,DC-Sweep-Analysis-Slides.zip,2817,4,DC-Sweep-Analysis-Codefiles.zip,2817,4,"",2817,6,301,2817,4,"Video tutorial, Ngspice, Performing DC sweep analysis, Nested DC sweep analysis.",1,4,2014-07-27 13:15:13,2014-07-27 13:15:58,,6,2817
414,414,Introduction-to-GChemPaint-Slides.zip,4917,4,"",4917,6,Introduction-to-GChemPaint-Assignment.pdf,4917,4,587,4917,4,"About GChemPaint, Installation, Open a new file, Menubar, Toolbar and Status bar, Display area, Document properties, tool box, Add a chain tool and video tutorial. ",1,4,2014-07-27 13:15:13,2014-10-28 11:30:31,,6,4917
415,415,Basic-operations-Slides.zip,4917,4,"",4917,6,Basic-operations-Assignment.pdf,4917,4,414,4917,4,"GchemPaint, Add and Edit text, Select, Move, Flip and Rotate objects, Group and Align Objects, Cut, copy, paste and delete objects, video tutorial.",1,4,2014-07-27 13:15:14,2014-07-27 13:15:59,,6,4917
416,416,View-Print-and-Export-structures-Slides.zip,4917,4,View-Print-and-Export-structures-Codefiles.zip,4917,4,View-Print-and-Export-structures-Assignment.pdf,4917,4,415,4917,4,"GchemPaint, View options, Zoom factor, Page setup, Portrait, Landscape, Reverse portrait, Reverse landscape, print, Export an image as SVG and PDF formats, video tutorial. ",1,4,2014-07-27 13:15:14,2014-07-27 13:15:59,,6,4917
417,417,Edit-Preferences-Templates-and-Residues-Slides.zip,4917,4,Edit-Preferences-Templates-and-Residues-Codefiles.zip,4917,4,Edit-Preferences-Templates-and-Residues-Assignment.txt,4917,4,416,4917,4,"GchemPaint, Edit Preferences, Manage Templates, Add New Templates, Residues, edit Residues,Video tutorial.",1,4,2014-07-27 13:15:14,2014-07-27 13:15:59,,6,4917
418,418,Formation-of-molecules-Slides.zip,4917,4,Formation-of-molecules-Codefiles.zip,4917,4,Formation-of-molecules-Assignment.txt,4917,4,417,4917,4,"GchemPaint, Alkyl groups, video tutorial, GChemPaint tools- Add or modify an atom, Add or modify a text, Select one or more objects, Add a bond or change the multiplicity of existing one.",1,4,2014-07-27 13:15:14,2014-07-27 13:16:00,,6,4917
419,419,Editing-molecules-Slides.zip,4917,4,"",4917,6,Editing-molecules-Assignment.txt,4917,4,464,4917,4,"Video tutorial, GchemPaint, GChemPaint tools- Add an electron pair to an atom, Add or modify an atom, Add a bond or change the multiplicity of the existing one, Add a six membered cycle, Increment the charge of an atom.",1,4,2014-07-27 13:15:14,2017-10-09 07:28:53,,6,4917
420,420,Aromatic-Molecular-Structures-Slides.zip,4917,4,"",4917,6,Aromatic-Molecular-Structures-Assignment.txt,4917,4,419,4917,4,"GchemPaint, Conversion of molecules, Merging  two molecules, Substituting hydrogen of benzene ring with atoms, video tutorial.",1,4,2014-07-27 13:15:14,2014-07-27 13:16:03,,6,4917
421,421,Analysis-of-compounds-Slides.zip,4917,4,Analysis-of-compounds-Codefiles.zip,4917,4,Analysis-of-compounds-Assignment.txt,4917,4,530,4917,4,"molecular contextual menu, add and edit a reaction, adding reactions conditions and reagents on the reaction arrow, convert reaction molecules into 3D, Gchempaint, video tutorial",7,4,2014-07-27 13:15:15,2020-04-21 11:47:29,,6,4917
422,422,for-and-each-Looping-Statements-Slides.zip,5128,4,for-and-each-Looping-Statements-Codefiles.zip,5128,4,for-and-each-Looping-Statements-Assignment.txt,5128,4,351,5128,4,"for, each, loop, Ruby, video tutorial.",1,4,2014-07-27 13:15:15,2014-09-05 12:25:45,,6,5128
423,423,while-and-until-Looping-Statements-Slides.zip,5128,4,while-and-until-Looping-Statements-Codefiles.zip,5128,4,while-and-until-Looping-Statements-Assignment.txt,1,4,422,5128,4,"while, until, redo, break, loop, Ruby, video tutorial",1,4,2014-07-27 13:15:15,2018-05-18 11:54:59,,6,5128
424,424,Introduction-to-PAN-Card-Slides.zip,4595,4,"",4595,6,"",4595,6,,4595,0," PAN Card, Structure and validation , video tutorial, Digital divide.",1,4,2014-07-27 13:15:15,2014-07-27 13:15:15,,6,4595
425,425,First-aid-measures-for-ChickenPox-Slides.zip,6590,4,"",6590,6,"",6590,6,,6590,0,"Measures for chickenpox, video tutorial, Digital divide.",1,4,2014-07-27 13:15:15,2014-07-27 13:15:15,,6,6590
426,426,Oral-Dental-Hygiene-and-Care-Slides.zip,4595,4,"",6589,6,"",6589,6,,4595,6,"oral hygiene, dental hygiene, dental care, video tutorial, Digital divide.",1,4,2014-07-27 13:15:16,2015-06-15 16:45:39,,6,4595
427,427,Contra-Transactions-Slides.zip,5373,5,"",5373,6,Contra-Transactions-Assignment.txt,5373,5,393,5373,4,video tutorial,1,0,2014-07-27 13:15:17,2015-10-05 07:22:50,,6,5373
428,428,First-C-Program-Slides.zip,2739,4,First-C-Program-Codefiles.zip,7,4,First-C-Program-Assignment.txt,2739,4,1131,2739,4,"C Program, printf(), int main(), Compile, execute, Video Tutorial, C and C++.",1,4,2014-07-27 13:15:17,2020-02-12 04:35:59,,6,2739
429,429,First-Cpp-Program-Slides.zip,2739,4,First-Cpp-Program-Codefiles.zip,7,4,First-Cpp-Program-Assignment.txt,7,4,1131,2739,4,"C++ program, compile, execute, common errors and their solution , int main(),C and C++, video tutorial",1,4,2014-07-27 13:15:17,2020-02-12 04:36:21,,6,2739
430,430,Tokens-Slides.zip,2739,4,Tokens-Codefiles.zip,7,4,Tokens-Assignment.txt,2739,4,429,2739,4,"Tokens, Data types, Variables, Identifiers, Constant, Video Tutorial , common errors and their solutions,  C and C++.",1,4,2014-07-27 13:15:17,2020-02-06 09:59:51,,6,2739
431,431,Functions-Slides.zip,2739,4,Functions-Codefiles.zip,7,4,Functions-Assignment.txt,2739,4,430,2739,4,"Functions, return statement, Video Tutorial, C and C++.",1,4,2014-07-27 13:15:17,2020-02-06 09:57:30,,6,2739
432,432,Scope-Of-Variables-Slides.zip,2739,4,Scope-Of-Variables-Codefiles.zip,7,4,Scope-Of-Variables-Assignment.txt,2739,4,431,2739,4,"Scope of variables, Global variable, local variable, Video tutorial, C and C++",1,4,2014-07-27 13:15:18,2020-02-06 09:59:17,,6,2739
433,433,If-And-Else-If-statement-Slides.zip,2739,4,If-And-Else-If-statement-Codefiles.zip,7,4,If-And-Else-If-statement-Assignment.txt,7,4,432,2739,4,"if, if-else,Execute single and group of statements, common errors and their solution, Video Tutorial, C and C++",1,4,2014-07-27 13:15:18,2020-02-06 10:01:27,,6,2739
434,434,Nested-If-And-Switch-Statement-Slides.zip,2739,4,Nested-If-And-Switch-Statement-Codefiles.zip,7,4,Nested-If-And-Switch-Statement-Assignment.txt,2739,4,433,2739,4,"If, Switch, Nested loops, video tutorial, C and C++",1,4,2014-07-27 13:15:18,2020-02-06 09:58:52,,6,2739
435,435,Increment-And-Decrement-Operators-Slides.zip,2739,4,Increment-And-Decrement-Operators-Codefiles.zip,7,4,Increment-And-Decrement-Operators-Assignment.txt,2739,4,434,2739,4,"Increment and Decrement Operators, Type casting, ++, --, Video Tutorial, C and C++",1,4,2014-07-27 13:15:18,2020-02-06 09:58:10,,6,2739
436,436,Arithmetic-Operators-Slides.zip,2739,4,Arithmetic-Operators-Codefiles.zip,7,4,Arithmetic-Operators-Assignment.txt,7,4,435,2739,4,"Arithmetic Operators, Addition, Subtraction, Division, Multiplication, C and C++, Video Tutorial",1,4,2014-07-27 13:15:18,2020-02-07 09:33:21,,6,2739
437,437,Relational-Operators-Slides.zip,2739,4,Relational-Operators-Codefiles.zip,7,4,Relational-Operators-Assignment.txt,7,4,436,2739,4,"Relational Operators, Less than, Greater than, Less than or equal to,Greater than or equal to, Equal to, Not equal to, C and C++,  Video Tutorial",1,4,2014-07-27 13:15:18,2020-02-06 10:02:05,,6,2739
438,438,Logical-Operators-Slides.zip,2739,4,Logical-Operators-Codefiles.zip,7,4,Logical-Operators-Assignment.txt,2739,4,437,2739,4,"Logical Operators, Logical AND, Logical OR, Logical NOT, C and C++, Video Tutorial",1,4,2014-07-27 13:15:19,2020-02-06 09:58:23,,6,2739
439,439,Loops-Slides.zip,7,4,Loops-Codefiles.zip,7,4,Loops-Assignment.txt,2739,4,438,2739,4,"Loops, for loop, while loop, do....while loop, type casting, and Video tutorial, C and C++",1,4,2014-07-27 13:15:19,2020-02-12 04:40:21,,6,2739
440,440,Arrays-Slides.zip,2739,4,Arrays-Codefiles.zip,7,4,Arrays-Assignment.txt,2739,4,439,2739,4,"Arrays, Declaration and initialization of an array, single dimensional, multi dimensional, video tutorial() , C and C++.",1,4,2014-07-27 13:15:19,2020-02-06 09:56:06,,6,2739
441,441,Working-With-2D-Arrays-Slides.zip,2739,4,Working-With-2D-Arrays-Codefiles.zip,7,4,Working-With-2D-Arrays-Assignment.txt,2739,4,440,2739,4,"2D arrays, Matrix addition, video tutorial() , C and C++.",1,4,2014-07-27 13:15:19,2020-02-06 10:00:17,,6,2739
442,442,Strings-Slides.zip,2739,4,Strings-Codefiles.zip,7,4,Strings-Assignment.txt,7,4,441,2739,4,"Strings in C, Declaration and Initialization of string , getline, Video Tutorial, C and C++.",1,4,2014-07-27 13:15:19,2020-02-06 09:59:41,,6,2739
443,443,String-Library-Functions-Slides.zip,2739,4,String-Library-Functions-Codefiles.zip,7,4,String-Library-Functions-Assignment.txt,7,4,442,2739,4,"String Library Functions, strcpy, strcat, strlen, Video Tutorial, C and C++.",1,4,2014-07-27 13:15:19,2020-02-06 10:01:56,,6,2739
444,444,Working-With-Structures-Slides.zip,2739,4,Working-With-Structures-Codefiles.zip,7,4,Working-With-Structures-Assignment.txt,2739,4,443,2739,4,"Strucutre,Declaration of structure, structure variable, Video tutorial, C and C++.",1,4,2014-07-27 13:15:19,2020-02-06 10:00:56,,6,2739
445,445,Understanding-Pointers-Slides.zip,2739,4,Understanding-Pointers-Codefiles.zip,7,4,Understanding-Pointers-Assignment.txt,2739,4,444,2739,4,"Pointers, Operations on pointers, video tutorial, C and C++.",1,4,2014-07-27 13:15:19,2020-02-06 10:00:05,,6,2739
446,446,Function-Call-Slides.zip,2739,4,Function-Call-Codefiles.zip,7,4,Function-Call-Assignment.txt,2739,4,445,2739,4,"Functions, call by value, call by reference, Video Tutorial , C and C++.",1,4,2014-07-27 13:15:20,2020-02-06 09:57:17,,6,2739
447,447,File-Handling-In-C-Slides.zip,2739,4,File-Handling-In-C-Codefiles.zip,7,4,File-Handling-In-C-Assignment.txt,2739,4,446,2739,4,"File handling, fopen, fclose, write and read data,  video tutorial, C and C++.",1,4,2014-07-27 13:15:20,2020-02-06 09:56:40,,6,2739
448,448,Classes-And-Objects-Slides.zip,2739,4,Classes-And-Objects-Codefiles.zip,2739,4,Classes-And-Objects-Assignment.txt,2739,4,447,2739,4,"Classes, Objects, Encapsulation, Data Abstraction, video tutorial, C++.",1,4,2014-07-27 13:15:20,2014-09-05 09:30:43,,6,2739
449,449,Constructor-And-Destructor-Slides.zip,2739,4,Constructor-And-Destructor-Codefiles.zip,2739,4,Constructor-And-Destructor-Assignment.txt,2739,4,448,2739,4,"Constructors, Types of constructors, Destructors, Video tutorial, C++",1,4,2014-07-27 13:15:20,2014-07-27 13:15:59,,6,2739
450,450,Static-Members-Slides.zip,2739,4,Static-Members-Codefiles.zip,2739,4,Static-Members-Assignment.txt,2739,4,449,2739,4,"Static keyword,  Static variable, static function, C++, Video tutorial.",1,4,2014-07-27 13:15:20,2014-07-27 13:15:59,,6,2739
451,451,Inheritance-Slides.zip,2739,4,Inheritance-Codefiles.zip,2739,4,Inheritance-Assignment.txt,2739,4,450,2739,4,"Inheritance, Single level Inheritance, Multilevel Inheritance, Multiple Inheritance, C++, Video tutorial.",1,4,2014-07-27 13:15:20,2014-07-27 13:15:59,,6,2739
452,452,More-On-Inheritance-Slides.zip,2739,4,More-On-Inheritance-Codefiles.zip,2739,4,More-On-Inheritance-Assignment.txt,2739,4,451,2739,4,"Multiple Inheritance, Hierarchical Inheritance, C++, Video tutorial",1,4,2014-07-27 13:15:20,2014-07-27 13:15:59,,6,2739
453,453,Function-Overloading-And-Overriding-Slides.zip,2739,4,Function-Overloading-And-Overriding-Codefiles.zip,2739,4,Function-Overloading-And-Overriding-Assignment.txt,2739,4,452,2739,4,"Overloading, Overriding, Video tutorial, C++.",1,4,2014-07-27 13:15:20,2014-07-27 13:15:59,,6,2739
454,454,Polymorphism-Slides.zip,2739,4,Polymorphism-Codefiles.zip,2739,4,Polymorphism-Assignment.txt,2739,4,453,2739,4,"polymorphism, virtual members, C++, Video tutorial.",1,4,2014-07-27 13:15:21,2014-07-27 13:15:59,,6,2739
455,455,Abstract-Class-Slides.zip,2739,4,Abstract-Class-Codefiles.zip,2739,4,Abstract-Class-Assignment.txt,2739,4,454,2739,4,"abstract class, pure virtual function, C++, Video tutorial.",1,4,2014-07-27 13:15:21,2014-07-27 13:15:59,,6,2739
456,456,Friend-Function-Slides.zip,2739,4,Friend-Function-Codefiles.zip,2739,4,Friend-Function-Assignment.txt,2739,4,455,2739,4,"friend function, C++, Video tutorial.",1,4,2014-07-27 13:15:21,2014-07-27 13:15:59,,6,2739
457,457,Exception-Handling-Slides.zip,2739,4,Exception-Handling-Codefiles.zip,7,4,Exception-Handling-Assignment.txt,2739,4,456,2739,4,"Exception handling, try, catch, throw, C++,  Video tutorial.",1,4,2014-07-27 13:15:21,2019-02-18 06:12:37,,6,2739
458,458,Exporting-GeoGebra-Files-Slides.zip,4917,4,"",4917,6,Exporting-GeoGebra-Files-Assignment.pdf,4917,4,20,4917,4,"Geogebra, Geogebra tools used- Move Graphics View, static picture, dynamic HTML webpage, Algebra and Spreadsheet Views,png, Scale, Resolution, Format, Advanced tab, enable moving labels, Firefox web browser sun-java6-plugin, Spoken tutorial, video tutorial",1,4,2014-07-27 13:15:21,2014-09-11 12:02:49,,6,4917
459,459,Overview-of-CellDesigner-Slides.zip,47177,4,"",47177,6,"",47177,6,,47177,6,"celldesigner, windows, linux, version 4.3, build, modify, components, process diagram, reaction, species, compartment, video tutorial",7,4,2014-07-27 13:15:21,2020-04-21 11:26:24,,6,47177
460,460,Installation-of-CellDesigner-Slides.zip,4778,4,"",4778,6,"",4778,6,459,4778,4,"installation of CellDesigner 4.3, video tutorial, CellDesigner 4.3",7,4,2014-07-27 13:15:21,2020-04-21 11:21:23,,6,4778
461,461,Getting-Started-with-CellDesigner-Slides.zip,4778,4,"",4778,6,Getting-Started-with-CellDesigner-Assignment.txt,7,4,460,4778,4,"CellDesigner, menu bar, toolbar, component, species, reaction, create and save network, export the image, zooming network, video tutorial",7,4,2014-07-27 13:15:22,2020-04-21 11:23:28,,6,4778
462,462,Printer-Connection-Slides.zip,1663,4,"",1663,6,"",1663,6,496,1663,4,"Printer connection, Video tutorial, Digital divide",1,4,2014-07-27 13:15:22,2014-09-11 12:08:42,,6,1663
463,463,How-to-apply-for-a-PAN-Card-Slides.zip,4595,4,"",4595,6,"",4595,6,424,4595,4,"Applying for a PAN Card and Tracking the status of the application, video tutorial , Digital divide.",1,4,2014-07-27 13:15:22,2014-09-11 12:08:08,,6,4595
464,464,Formation-of-Bonds-Slides.zip,4917,4,"",4917,6,Formation-of-Bonds-Assignment.txt,4917,4,418,4917,4,"GchemPaint, Video tutorial, Add bonds to the existing bond, Orient bonds, Add Stereochemical bonds and Inverse wedge hashes GChemPaint tools- Add a bond or change the multiplicity of an existing one, Add a wedge bond, Add a hash bond, Add a squiggle bond and Add a fore bond.",1,4,2014-07-27 13:15:22,2014-07-27 13:16:00,,6,4917
465,465,Create-Account-in-GNUKhata-Slides.zip,5373,5,"",5373,6,Create-Account-in-GNUKhata-Assignment.txt,5373,5,427,5373,4,video tutorial,1,0,2014-07-27 13:15:22,2015-10-05 07:24:01,,6,5373
466,466,Journal-transaction-Slides.zip,5373,5,"",1,0,Journal-transaction-Assignment.txt,5373,5,465,5373,4,video tutorial,1,0,2014-07-27 13:15:22,2015-10-05 07:25:12,,6,5373
467,467,Downloading-and-installing-Salome-Slides.zip,5858,4,"",5858,6,"",5858,6,378,5858,4,"Video tutorial,CFD, Downloading and Installing Salome, OpenFOAM.",1,4,2014-07-27 13:15:22,2019-06-13 06:29:38,,6,5858
468,468,Creating-and-meshing-a-curved-pipe-geometry-in-Salome-for-OpenFOAM-Slides.zip,5858,4,Creating-and-meshing-a-curved-pipe-geometry-in-Salome-for-OpenFOAM-Codefiles.zip,5858,4,Creating-and-meshing-a-curved-pipe-geometry-in-Salome-for-OpenFOAM-Assignment.pdf,5858,4,467,5858,4,"Video tutorial,CFD, OpenFOAM, Creating curved pipe geometry in Salome, To mesh the geometry, modifying the mesh using submesh.",1,4,2014-07-27 13:15:23,2014-07-27 13:15:59,,6,5858
469,469,Exporting-geometry-from-Salome-to-OpenFOAM-Slides.zip,5858,4,Exporting-geometry-from-Salome-to-OpenFOAM-Codefiles.zip,5858,4,Exporting-geometry-from-Salome-to-OpenFOAM-Assignment.pdf,5858,4,468,5858,4,"Video tutorial,CFD, OpenFOAm, Grouping the meshed geometry parts in Salome, Exporting the geometry to OpenFOAM, Creating a case directory.",1,4,2014-07-27 13:15:23,2014-07-27 13:16:00,,6,5858
470,470,The-grep-command-Slides.zip,2739,4,The-grep-command-Codefiles.zip,2739,4,The-grep-command-Assignment.txt,2739,4,18,2739,4,"Linux, Search,Pattern,regular expressions,extended regular expression , video tutorial",1,4,2014-07-27 13:15:23,2014-12-05 07:02:07,,6,2739
471,471,More-on-grep-command-Slides.zip,2739,4,More-on-grep-command-Codefiles.zip,2739,4,More-on-grep-command-Assignment.txt,2739,4,470,7,4,"Linux, Search, Pattern, regular expressions, extended regular expression, video tutorial",7,4,2014-07-27 13:15:23,2020-04-21 12:53:38,,6,2739
472,472,The-sed-command-Slides.zip,2739,4,The-sed-command-Codefiles.zip,7,4,The-sed-command-Assignment.txt,2739,4,471,2739,4,"Linux, stream, editor, display, substitute, insert, delete, video tutorial.",1,4,2014-07-27 13:15:23,2019-07-26 09:46:51,,6,2739
473,473,More-on-sed-command-Slides.zip,2739,4,More-on-sed-command-Codefiles.zip,7,4,More-on-sed-command-Assignment.txt,2739,4,472,2739,4,"Linux, sed, substitute, insert, delete, video tutorial.",1,4,2014-07-27 13:15:24,2019-07-26 09:47:44,,6,2739
