id,tutorial_detail_id,slide,slide_user_id,slide_status,code,code_user_id,code_status,assignment,assignment_user_id,assignment_status,prerequisite_id,prerequisite_user_id,prerequisite_status,keyword,keyword_user_id,keyword_status,created,updated,additional_material,additional_material_status,additional_material_user_id
1134,1235,Adding-Radio-Buttons-Slides.zip,36848,4,Adding-Radio-Buttons-Codefiles.zip,36848,4,Adding-Radio-Buttons-Assignment.txt,36848,4,1234,36848,4,"radio buttons, radio groups, kotlin, android studio, android app, video tutorial, spoken tutorial",7,4,2019-01-29 06:22:27,2019-07-29 12:17:24,,6,36848
1135,1234,Creating-a-Registration-form-Slides.zip,36848,4,Creating-a-Registration-form-Codefiles.zip,36848,4,Creating-a-Registration-form-Assignment.txt,36848,4,1213,36848,4,"kotlin, android studio, text view, buttons, plain text, layout editor, video tutorials",36848,4,2019-01-29 06:40:12,2019-07-29 12:17:34,,6,36848
1136,1244,User-Password-Management-Slides.zip,1479,4,"",1479,6,User-Password-Management-Assignment.txt,7,4,1134,1479,4,"passwd, chage,  changing user password, locking and unlocking password, password removal, password expiry, video tutorial, spoken tutorial",7,4,2019-02-05 03:09:18,2019-07-30 09:35:12,,6,1479
1137,1245,Modifying-User-Account-Slides.zip,1479,4,"",1479,6,Modifying-User-Account-Assignment.txt,7,4,1244,1479,4,"usermod, change,  lock password, unlock password, lock account, unlock account, change home directory, change shell, change comments, video tutorial, spoken tutorial",1479,4,2019-02-05 03:10:58,2019-07-30 09:35:29,,6,1479
1138,1247,Administrating-Group-with-gpasswd-command-Slides.zip,1479,4,"",1479,6,Administrating-Group-with-gpasswd-command-Assignment.txt,7,4,1246,1479,4,"group password, adding group member and administrator, deleting member, removing password, restricting password, gpasswd, newgrp, video tutorial, spoken tutorial",1479,4,2019-02-05 03:11:44,2019-02-18 12:25:34,,6,1479
1139,1248,Modifying-and-Deleting-Groups-Slides.zip,1479,4,"",1479,6,Modifying-and-Deleting-Groups-Assignment.txt,1479,4,1247,1479,4,"groupmod, groupdel, change group name, change gid, delete group, video tutorial, spoken tutorial",1479,4,2019-02-05 03:12:33,2019-02-18 12:25:41,,6,1479
1140,1246,Group-Password-and-Login-Slides.zip,1479,4,"",1479,6,Group-Password-and-Login-Assignment.txt,1479,4,1245,1479,4,"group password, login to a group, gpasswd, newgrp, su, video tutorial, spoken tutorial",1479,4,2019-02-05 03:13:24,2019-02-18 12:26:15,,6,1479
1141,1219,Cradle-Hold-for-Breastfeeding-Slides.zip,1498132,4,"",1498132,6,"",1498132,6,,1498132,6,"breastfeeding holds, positions, cradle hold, baby, mother, breastfeeding, breast milk, spoken tutorial, video tutorial",1498132,4,2019-02-05 03:47:24,2019-02-11 12:59:43,,6,1498132
1143,1249,Indexing-and-Slicing-Data-Frames-Slides.zip,7,4,Indexing-and-Slicing-Data-Frames-Codefiles.zip,7,4,Indexing-and-Slicing-Data-Frames-Assignment.pdf,7,4,507,46796,4,"r, rstudio, data frames, indexing, slicing, working directory, video tutorial",46796,4,2019-02-07 07:34:44,2019-10-07 07:52:10,Indexing-and-Slicing-Data-Frames-Additionalmaterial.pdf,4,46796
1144,1250,Creating-Matrices-using-Data-Frames-Slides.zip,7,4,Creating-Matrices-using-Data-Frames-Codefiles.zip,7,4,Creating-Matrices-using-Data-Frames-Assignment.pdf,7,4,1209,46796,4,"r, rstudio, matrices, data frames, transpose, determinant, video tutorial.",46796,4,2019-02-21 07:14:43,2019-10-07 07:51:33,Creating-Matrices-using-Data-Frames-Additionalmaterial.pdf,4,46796
1145,1192,Generate-3D-plots-and-surfaces-Slides.zip,1964363,4,"",1964363,6,Generate-3D-plots-and-surfaces-Assignment.txt,1964363,4,1191,1964363,4,"gnuplot, 3d plot, splot command, 3d surface, set isosamples, equation for a sphere, parametric mode, gnuplot script, change color, heatmap, video tutorial.",1964363,4,2019-02-22 12:00:01,2019-12-31 08:01:59,Generate-3D-plots-and-surfaces-Additionalmaterial.pdf,4,1964363
1146,1194,Multiple-plots-in-a-canvas-Slides.zip,1964363,4,Multiple-plots-in-a-canvas-Codefiles.zip,1964363,4,Multiple-plots-in-a-canvas-Assignment.txt,1964363,4,1192,1964363,4,"gnuplot, multiplot, plot size, plot position, gnuplot script, set object, unset object, unset format, svg format, set output file, unset multiplot, video tutorial.
",1964363,4,2019-02-22 12:07:59,2020-01-24 06:21:46,Multiple-plots-in-a-canvas-Additionalmaterial.pdf,4,1964363
1147,1193,Set-term-and-variations-in-output-Slides.zip,1964363,4,Set-term-and-variations-in-output-Codefiles.zip,1964363,4,Set-term-and-variations-in-output-Assignment.txt,1964363,4,1190,1964363,4,"gnuplot, terminal types, interactive terminal, set term, set output, save to a file, postscript file, svg image file, background color, save term, pop term, ascii, dumb command, sin(x), video tutorial.",1964363,4,2019-03-08 09:59:51,2019-11-29 12:32:56,,6,1964363
1148,1256,Simple-Machines-Slides.zip,1890175,4,"",1890175,6,Simple-Machines-Assignment.txt,1890175,4,,1890175,6,"apps on physics, pulley, load, lever, torque, distance, springscale, force, balance condition, video tutorial",1890175,4,2019-03-12 12:08:13,2019-05-21 04:13:26,Simple-Machines-Additionalmaterial.pdf,4,1890175
1149,1251,Operations-on-Matrices-and-Data-Frames-Slides.zip,7,4,Operations-on-Matrices-and-Data-Frames-Codefiles.zip,7,4,Operations-on-Matrices-and-Data-Frames-Assignment.pdf,7,4,1250,46796,4,"r, rstudio, matrices, data frames, adding row, adding column, video tutorial ",46796,4,2019-03-13 17:43:28,2019-10-04 19:40:16,Operations-on-Matrices-and-Data-Frames-Additionalmaterial.pdf,4,46796
1150,1252,Merging-and-Importing-Data-Slides.zip,7,4,Merging-and-Importing-Data-Codefiles.zip,7,4,Merging-and-Importing-Data-Assignment.pdf,7,4,507,46796,4,"r, rstudio, data merge, data import, video tutorial",46796,4,2019-03-19 12:21:23,2019-10-07 07:49:45,Merging-and-Importing-Data-Additionalmaterial.pdf,4,7
1151,1265,Adding-spinner-and-Image-Slides.zip,36848,4,Adding-spinner-and-Image-Codefiles.zip,36848,4,Adding-spinner-and-Image-Assignment.txt,36848,4,1235,36848,4,"spinner, image, android studio, kotlin, setonclicklistener, arrayadapter, onitemselectedlistener, onnothingselected, onitemselected, video tutorials, spoken tutorial,",36848,4,2019-04-02 06:02:39,2019-07-29 12:17:42,,6,36848
1152,1253,Data-types-and-Factors-Slides.zip,7,4,Data-types-and-Factors-Codefiles.zip,7,4,Data-types-and-Factors-Assignment.pdf,7,4,507,46796,4,"r, rstudio, factor, levels, categorical, video tutorial",46796,4,2019-04-05 09:53:27,2019-10-07 07:48:31,Data-types-and-Factors-Additionalmaterial.pdf,4,46796
1153,1267,Introduction-to-Marble-Slides.zip,582954,4,"",582954,6,Introduction-to-Marble-Assignment.txt,582954,4,1419,582954,4,"marble, marble interface, compass, home location, bookmark, overview map, wind rose, zoom slider, status bar, scale bar, menu bar, toolbar, panels, video tutorial.",582954,4,2019-04-05 10:08:27,2020-01-27 13:49:49,,6,582954
1154,1223,Hand-expression-of-breastmilk-Slides.zip,1498132,4,"",1498132,6,"",1498132,6,,1498132,6,"breastmilk, breastfeeding, hand expression, breastmilk expression, cup feeding, mother, sore nipple, oxytocin reflex, let down reflex. baby, spoken tutorial, video tutorial.",47177,4,2019-04-09 07:35:24,2019-05-14 10:14:58,,6,1498132
1155,1210,Overview-of-R-and-RStudio-Slides.zip,46796,4,"",46796,6,"",46796,6,,46796,6,"r, rstudio, command-line interface, pie chart, programming, video tutorial",46796,4,2019-04-11 12:11:13,2020-06-11 10:39:28,,6,46796
1156,1254,Lists-and-its-Operations-Slides.zip,7,4,Lists-and-its-Operations-Codefiles.zip,7,4,Lists-and-its-Operations-Assignment.pdf,7,4,1250,46796,4,"r, rstudio, data types, data frame, vector, atomic vector, lists, indexing, slicing, video tutorial",46796,4,2019-04-11 12:15:08,2019-10-07 07:47:09,Lists-and-its-Operations-Additionalmaterial.pdf,4,46796
1157,1271,Introduction-to-Scilab-and-its-benefits-Slides.zip,7,4,"",7,6,"",7,6,,7,6,"scilab,  benefits of scilab, video tutorial, spoken tutorial",7,4,2019-04-15 08:02:28,2019-04-15 09:36:26,,6,7
1158,1272,Self-learning-of-Scilab-through-Spoken-Tutorials-Slides.zip,7,4,"",7,6,"",7,6,,7,6,"self learning of scilab through spoken tutorials, scilab, video tutorial, spoken tutorial",7,4,2019-04-15 08:52:45,2019-04-15 09:36:36,,6,7
1159,1273,The-amazing-resource-of-Scilab-Textbook-Companion-Slides.zip,7,4,"",7,6,"",7,6,,7,6,"scilab textbook companion, scilab resource, video tutorial, spoken tutorial",7,4,2019-04-15 09:08:56,2019-04-15 09:43:07,,6,7
1160,1274,"Scilab-Lab-migration,-Toolboxes-and-Forums-Slides.zip",7,4,"",7,6,"",7,6,,7,6,"scilab lab migration, toolboxes, forums, video tutorial, spoken tutorial",7,4,2019-04-15 09:19:07,2019-04-15 09:37:02,,6,7
1161,1275,Creating-a-Search-App-Slides.zip,36848,4,Creating-a-Search-App-Codefiles.zip,36848,4,Creating-a-Search-App-Assignment.txt,36848,4,1265,36848,4,"android studio project, kotlin, spinner, text view, button, search app, spoken tutorials, video tutorials.",36848,4,2019-04-16 05:42:16,2019-07-29 12:17:53,,6,36848
1162,1058,Creating-a-Map-Slides.zip,14794,4,Creating-a-Map-Codefiles.zip,14794,4,Creating-a-Map-Assignment.txt,14794,4,1057,14794,4,"gis, qgis, crs, creating a map, print composer, map elements, item properties, import image, video tutorial.",14794,4,2019-04-22 05:15:18,2019-05-03 06:27:23,Creating-a-Map-Additionalmaterial.pdf,4,14794
1163,1276,Installation-of-LDmicro-on-Linux-Slides.zip,1982346,4,"",1982346,6,"",1982346,6,,1982346,6,"ladder logic, ldmicro, ldmicro installation, avrdude installation, usbasp programmer drivers installation, video tutorials, spoken tutorial
",1982346,4,2019-04-24 07:07:53,2019-05-01 09:23:35,,6,1982346
1165,1226,Non-vegetarian-recipes-for-6-month-old-babies-Slides.zip,1384689,4,"",1384689,6,"",1384689,6,,1384689,6,"spoken tutorial, video tutorial, recipes, complementary feeding, non-vegetarian recipes, egg puree, fish puree, raw banana fish porridge, chicken puree, chicken carrot puree",47177,4,2019-04-30 09:55:01,2019-05-17 07:23:41,,6,1384689
1166,1215,Custom-Unit-Operation-using-Scilab-Slides.zip,3900,4,"",3900,6,Custom-Unit-Operation-using-Scilab-Assignment.pdf,3900,4,719,3900,4,"dwsim, scilab cape-open unit operation, cape-open object editor, ports tab, script editor, getfeedprop command, totf variable, setproduct, video tutorial",7,4,2019-04-30 11:36:20,2020-04-21 11:35:25,Custom-Unit-Operation-using-Scilab-Additionalmaterial.pdf,4,3900
1167,1225,Vegetarian-recipes-for-6-month-old-babies-Slides.zip,1384689,4,"",1384689,6,"",1384689,6,,1384689,6,"spoken tutorial, video tutorial, complementary feeding, vegetarian recipes, 6 month old babies, black-eyed beans puree, pumpkin puree, ragi porridge, sorghum porridge, spinach leaves puree
",1384689,4,2019-04-30 14:38:34,2020-01-04 18:40:05,,6,1384689
1168,1277,Plotting-Histograms-and-Pie-Chart-Slides.zip,7,4,Plotting-Histograms-and-Pie-Chart-Codefiles.zip,7,4,Plotting-Histograms-and-Pie-Chart-Assignment.pdf,7,4,507,7,4,"r, rstudio, graphs, histogram, frequency, pie chart, video tutorial, spoken tutorial ",46796,4,2019-05-01 09:38:21,2019-10-07 07:45:31,Plotting-Histograms-and-Pie-Chart-Additionalmaterial.pdf,4,7
1169,1205,Create-action-object-Tools-Slides.zip,4917,4,Create-action-object-Tools-Codefiles.zip,4917,4,Create-action-object-Tools-Assignment.txt,4917,4,1204,4917,4,"geogebra, free objects, dependent objects, check-box, insert button, input box,  slider tool, tangents to a circle tool, video tutorial.",4917,4,2019-05-03 09:32:42,2019-05-29 09:43:04,Create-action-object-Tools-Additionalmaterial.txt,4,4917
1170,1258,Linear-Motion-Slides.zip,1890175,4,"",1890175,6,Linear-Motion-Assignment.txt,1890175,4,1257,1890175,4,"apps on physics, linear motion, equations of motion, newton's first law, acceleration, position, velocity, wagon, mass, friction, newton's second law, video tutorial.",1890175,4,2019-05-06 05:22:04,2019-06-17 12:17:01,Linear-Motion-Additionalmaterial.pdf,4,1890175
1171,1127,Overview-of-Kotlin-Slides.zip,36848,4,"",36848,6,"",36848,6,,36848,6,"kotlin, android studio, overview of andorid app using kotlin, video tutorial, spoken tutorial",36848,4,2019-05-07 06:58:22,2019-08-27 06:54:35,,6,7
1172,1278,Installation-of-LDmicro-on-Windows-Slides.zip,1982346,4,"",1982346,6,"",1982346,6,,1982346,6,"ladder logic, ldmicro, ldmicro installation on windows, avrdude installation on windows, usbasp programmer drivers installation on windows, disable driver signature enforcement, spoken tutorial, video tutorials",1982346,4,2019-05-10 04:25:35,2019-05-31 12:17:27,,6,1982346
1173,1238,Nodes-and-basic-commands-Slides.zip,1964363,4,"",1964363,6,Nodes-and-basic-commands-Assignment.txt,1964363,4,1237,1964363,4,"freeplane, concept map, node, child node, sibling node, concept map, 
node style, move a node, video tutorial.",1964363,4,2019-05-14 05:32:56,2020-05-11 12:24:11,Nodes-and-basic-commands-Additionalmaterial.pdf,4,1964363
1174,1068,Overview-of-HTML-Slides.zip,1479,4,"",1479,6,"",1479,6,,1479,6,"html, introduction to html, html overview, web designing, website, spoken tutorial, video tutorial ",1479,4,2019-05-14 05:33:34,2019-06-29 03:51:32,,6,7
1175,1279,Doctype-and-Head-Section-Slides.zip,1479,4,Doctype-and-Head-Section-Codefiles.zip,1479,4,Doctype-and-Head-Section-Assignment.txt,1479,4,1099,1479,4,"html, doctype,  title, style, css, java script, meta data, file linking, script, base tag, spoken tutorial, video tutorial",1479,4,2019-05-16 10:07:37,2019-05-24 12:17:30,,6,1479
1176,1280,Embedding-Images-Slides.zip,1479,4,Embedding-Images-Codefiles.zip,1479,4,Embedding-Images-Assignment.txt,1479,4,1279,1479,4,"html, embedding images, image height, image width, linking image, image map, background image, spoken tutorial, video tutorial",1479,4,2019-05-16 10:12:27,2019-05-24 12:17:37,,6,1479
1177,1281,Embedding-Audio-and-Video-Slides.zip,1479,4,Embedding-Audio-and-Video-Codefiles.zip,1479,4,Embedding-Audio-and-Video-Assignment.txt,1479,4,1280,1479,4,"html, media, embed tag, html5, html5 audio, html5 video, html5 audio formats, html5 video formats, audio video controls, audio attributes, video attributes, html5 browser support, ogg, ogv, mp3, mp4, spoken tutorial, video tutorial",7,4,2019-05-16 10:16:43,2020-04-21 11:54:36,,6,1479
1178,1282,Block-Elements-and-Layouts-Slides.zip,1479,4,Block-Elements-and-Layouts-Codefiles.zip,1479,4,Block-Elements-and-Layouts-Assignment.txt,1479,4,1281,1479,4,"html, block elements, inline elements, web layout, div tag, span tag, html5 layout, header, footer, navigation, article, aside, spoken tutorial, video tutorial",1479,4,2019-05-16 10:20:43,2019-05-31 12:06:22,,6,1479
1179,1283,Forms-in-HTML-Slides.zip,1479,4,Forms-in-HTML-Codefiles.zip,1479,4,Forms-in-HTML-Assignment.txt,1479,4,1282,1479,4,"html, html forms, form elements, input, label, button, input types, text, email, password, spoken tutorial, video tutorial",1479,4,2019-05-16 10:24:49,2019-05-31 12:06:28,,6,1479
1180,1284,More-on-Forms-Slides.zip,1479,4,More-on-Forms-Codefiles.zip,1479,4,More-on-Forms-Assignment.txt,1479,4,1283,1479,4,"html, form input types, date, radio, number, form elements, select, datalist, fieldset form methods, get, post, html forms, spoken tutorial, video tutorial",7,4,2019-05-16 10:28:19,2020-04-21 11:54:57,,6,1479
1181,1285,Plotting-Bar-Charts-and-Scatter-Plot-Slides.zip,7,4,Plotting-Bar-Charts-and-Scatter-Plot-Codefiles.zip,7,4,Plotting-Bar-Charts-and-Scatter-Plot-Assignment.pdf,7,4,1277,46796,4,"r, rstudio, graphs, bar chart, labels, scatter plot, correlation, video tutorial. ",46796,4,2019-05-18 13:34:49,2019-10-07 07:22:16,Plotting-Bar-Charts-and-Scatter-Plot-Additionalmaterial.pdf,4,7
1182,1257,Inclined-Plane-Slides.zip,1890175,4,"",1890175,6,Inclined-Plane-Assignment.txt,1890175,4,1256,1890175,4,"apps on physics,  inclined plane, angle of inclination, springscale, force, velocity, gravity, parallel force, perpendicular force, frictional force, video tutorial.",1890175,4,2019-05-20 06:28:37,2019-06-13 06:46:26,,6,1890175
1183,1289,Introduction-to-OpenIPSL-Slides.zip,1896637,4,"",1896637,6,"",1896637,6,855,1896637,4,"openmodelica, openipsl, library structure, power systems, spoken tutorial, video tutorial
",1896637,4,2019-05-21 07:25:14,2019-05-27 02:12:04,,6,1896637
1184,1109,Models-of-the-Hydrogen-Atom-Slides.zip,1385807,4,"",1385807,6,Models-of-the-Hydrogen-Atom-Assignment.txt,1385807,4,1108,1385807,4,"phet simulation, atomic models, nucleus, electron, proton, orbits, electron energy level, hydrogen atom, monochromatic light, photon, billiard ball model, rutherford scattering, plum pudding model, bohr model, debroglie model, schrödinger model, quantum numbers, video tutorial",1385807,4,2019-05-21 12:21:25,2019-05-31 11:40:40,Models-of-the-Hydrogen-Atom-Additionalmaterial.pdf,4,1385807
1185,1214,Custom-Unit-Operation-using-Python-Slides.zip,3900,4,Custom-Unit-Operation-using-Python-Codefiles.zip,3900,4,Custom-Unit-Operation-using-Python-Assignment.txt,3900,4,1215,3900,4,"dwsim, python script editor, getprop function, setprop function, out.propertypackage.dw_calcequilibrium function, propertypackages.flashspec keyword, none keyword, video tutorial",7,4,2019-05-23 05:33:25,2020-04-21 11:34:58,,6,3900
1186,1290,Demonstration-of-a-model-Slides.zip,1896637,4,Demonstration-of-a-model-Codefiles.zip,1896637,4,Demonstration-of-a-model-Assignment.txt,1896637,4,1289,1896637,4,"smib, single machine infinite bus, openmodelica, omedit, openipsl, power systems, spoken tutorial, video tutorial
",1896637,4,2019-05-24 03:51:17,2019-06-13 09:33:16,,6,1896637
1188,1288,"",1896637,0,"",1896637,0,"",1896637,0,,1896637,0,"",1896637,0,2019-06-10 07:32:55,2019-06-10 07:32:55,,0,
1189,1286,Introduction-to-ggplot2-Slides.zip,7,4,Introduction-to-ggplot2-Codefiles.zip,7,4,Introduction-to-ggplot2-Assignment.pdf,7,4,1285,46796,4,"r, rstudio, aesthetics, seq function, data visualization, grammar of graphics, legend function, ggplot2 package, scatter plot, ggsave function, video tutorial. ",46796,4,2019-06-10 12:14:23,2019-10-04 19:39:05,,6,46796
1190,1292,Mapping-Components-with-Footprints-Slides.zip,7,4,Mapping-Components-with-Footprints-Codefiles.zip,83987,4,"",7,6,1359,83987,4,"esim, mapping, footprints, eda, schematic, simulation, design, components, pcb, video tutorial.",83987,4,2019-06-10 12:16:24,2019-09-18 13:17:49,,6,83987
1191,1293,Setting-Parameters-for-PCB-designing-Slides.zip,83987,4,Setting-Parameters-for-PCB-designing-Codefiles.zip,7,4,"",7,6,1292,83987,4,"video tutorial, esim, footprints, pcb design, eda, schematic, cvpcb, pcbnew",7,4,2019-06-10 12:30:39,2020-04-21 11:36:38,,6,83987
1192,1294,Laying-Tracks-on-PCB-Slides.zip,83987,4,Laying-Tracks-on-PCB-Codefiles.zip,83987,4,"",7,6,1293,83987,4,"video tutorial, esim, footprints, pcb design, eda, schematic, gerber, pcbnew",7,4,2019-06-10 12:44:34,2020-04-21 11:36:50,,6,83987
1193,1042,"",47177,0,"",47177,0,"",47177,0,,47177,0,"",47177,0,2019-06-12 10:10:36,2019-06-12 10:10:36,,0,
1194,1023,Pre-pregnancy-Nutrition-Slides.zip,1965697,4,"",1965697,6,"",1965697,6,,1965697,6,"pre- pregnancy nutrition, proteins, fats, omega-3 fatty acids, vitamins, vitamin-a, vitamin-b complex, folate, iron, phytic acid, oxalates, cooking methods, vitamin-c, calcium, vitamin-d, choline, zinc, iodine, magnesium, substance abuse, weight maintenance, obesity, neonatal health, low birth weight baby, healthy pregnancy, food sources, spoken tutorial, video tutorial
",47177,4,2019-06-12 11:13:45,2019-07-31 10:53:20,,6,1965697
1195,1268,Panels-in-Marble-Slides.zip,582954,4,"",582954,6,Panels-in-Marble-Assignment.txt,582954,4,1267,582954,4,"panels, search, routing, location, map view, atlas view, open street map, satellite view, earth at night, legend, globe view, mercator view, flat view, perspective globe view, moon view, lunar highlands, mare, default panels, settings menu, edit maps, tour, files panel, geo data document, video tutorial.",582954,4,2019-06-17 05:45:54,2020-01-27 13:50:08,Panels-in-Marble-Additionalmaterial.pdf,4,582954
1196,1296,Heterogeneous-Catalytic-Reaction-Slides.zip,3900,4,"",3900,6,Heterogeneous-Catalytic-Reaction-Assignment.pdf,3900,4,914,3900,4,"dwsim, heterogeneous catalytic reaction, reaction rate coefficients, partial pressure, stoichiometry, heat of formation, numerator, denominator, amount unit, velocity unit, catalyst unit, video tutorial",3900,4,2019-06-17 06:13:44,2019-08-06 06:07:35,,6,3900
1197,1307,Vegetarian-recipes-for-lactating-mothers-Slides.zip,2119135,4,"",2119135,6,"",2119135,6,1036,2119135,4,"spoken tutorial, video tutorial, nutrition during lactation, sprouted green gram, galactogogues, seeds, peanut tikki, flaxseed chutney, bajra muthia, sprouts chilla, fenugreek sprouts curry, milk production, healthy recipes, sprouts, essential nutrients
",2119135,4,2019-06-19 10:13:32,2019-08-10 11:39:49,,6,2119135
1198,1100,Overview-of-GeoGebra-Slides.zip,4917,4,"",4917,6,Overview-of-GeoGebra-Assignment.txt,4917,4,,4917,6,"geogebra, installation on linux ubuntu 16.04, installation on windows 10, online geogebra math apps, classroom resources, video tutorial.",4917,4,2019-06-20 09:10:29,2019-07-01 11:32:17,,6,4917
1199,1314,Plugins-in-Moodle-Slides.zip,7943,4,"",7943,6,Plugins-in-Moodle-Assignment.txt,7943,4,1107,7943,4,"plugins in moodle, moodle video tutorials, install moodle plugin, moodle plugins directory, moodle plugin through zip upload, factors to consider when installing a plugin, moodle plugin install error, plugins overview , install attendance plugin, create attendance sessions in moodle",7943,4,2019-06-21 11:01:18,2019-07-01 05:58:58,,6,7943
1200,1318,Django-Shell-and-Django-Database-Query-Slides.zip,1479,4,"",1479,6,Django-Shell-and-Django-Database-Query-Assignment.txt,1479,4,1137,1479,4,"django shell, django database query, django, python, spoken tutorial, video tutorial",1479,4,2019-06-26 05:08:21,2019-10-28 04:43:47,,6,1479
1201,1315,URL-Request-Slides.zip,36848,4,URL-Request-Codefiles.zip,36848,4,URL-Request-Assignment.txt,36848,4,1275,36848,4,"application programming interface, api, volley library, picasso, json parsing, request.method, url, make a request to url, response.listener, response.errorlistener, fetch data, kotlin app, android studio, spoken tutorial, video tutorial, ",7,4,2019-06-26 11:43:30,2019-07-29 12:19:10,,6,36848
1202,1316,Display-Search-Result-Slides.zip,36848,4,Display-Search-Result-Codefiles.zip,36848,4,Display-Search-Result-Assignment.txt,36848,4,1315,36848,4,"recycler view,  spoken tutorial youtube url, kotlin app, json data, api, thumbnail of videos, android studio, spoken tutorial, video tutorial",7,4,2019-06-27 12:07:27,2019-07-29 12:19:29,,6,36848
1203,1317,Playing-video-using-YouTube-API-Slides.zip,36848,4,Playing-video-using-YouTube-API-Codefiles.zip,36848,4,Playing-video-using-YouTube-API-Assignment.txt,36848,4,1316,36848,4,"create project in google cloud, youtube api, youtubeplayerview in android studio, enable apis and services, youtube data api v3, api key, youtubeandroidplayerapi.jar, spoken tutorial, video tutorial",36848,4,2019-07-01 10:18:54,2019-07-29 12:19:39,,6,36848
1204,1297,Search-places-and-Measure-distances-Slides.zip,582954,4,"",582954,6,Search-places-and-Measure-distances-Assignment.txt,582954,4,1268,582954,4,"marble, search places, search box, global search, area search, place information data sheet, coordinates table, fact sheet, measure distances, context menu, add measure points, remove measure points, video tutorial.",582954,4,2019-07-02 06:52:06,2020-01-27 13:50:15,,6,582954
1205,1287,Aesthetic-Mapping-in-ggplot2-Slides.zip,7,4,Aesthetic-Mapping-in-ggplot2-Codefiles.zip,7,4,Aesthetic-Mapping-in-ggplot2-Assignment.pdf,7,4,1286,46796,4,"r, rstudio, ggplot2, ggplot, aesthetic, mapping, video tutorial",46796,4,2019-07-09 12:41:49,2019-10-04 19:36:58,,6,46796
1206,1260,Keplers-laws-Slides.zip,1890175,4,"",1890175,6,Keplers-laws-Assignment.txt,1890175,4,1258,1890175,4,"apps on physics, kepler's first law, kepler's second law, aphelion, perihelion, planets, velocity, orbital period, elliptical orbit, numerical eccentricity, semimajor axis, semiminor axis, video tutorial.",1890175,4,2019-07-19 04:44:14,2019-09-20 12:23:20,Keplers-laws-Additionalmaterial.pdf,4,1890175
1207,1321,Sequences-in-GeoGebra-Slides.zip,4917,4,Sequences-in-GeoGebra-Codefiles.zip,4917,4,Sequences-in-GeoGebra-Assignment.txt,4917,4,1205,4917,4," geogebra, spreadsheet view, input bar, sequence command, segment command, arithmetic progression, geometric progression, video tutorial.",4917,4,2019-07-23 05:07:16,2019-09-06 05:29:55,Sequences-in-GeoGebra-Additionalmaterial.pdf,4,4917
1208,1322,Introduction-to-LDmicro-Slides.zip,1982346,4,"",1982346,6,"",1982346,6,1276,1982346,4,"openplc, ladder logic, ldmicro interface/gui, rungs, rails, contacts, coils, video tutorials, spoken tutorials",1982346,4,2019-07-24 07:39:51,2020-06-11 10:44:24,,6,1982346
1209,1323,Introduction-to-OpenFOAM-Slides.zip,7,4,"",2149126,6,"",2149126,6,9,2149126,4,"overview, cfd, computational fluid dynamics, open source equivalent to fluent, openfoam, solvers, parallel processing, meshing tool, ",7,4,2019-07-26 12:32:03,2019-08-27 09:46:09,,6,2149126
1210,1309,Storage-of-expressed-breastmilk-Slides.zip,1498132,4,"",1498132,6,"",1498132,6,,1498132,6,"breastmilk, safe storage, breastfeeding, storage of breastmilk, expression, frozen breastmilk, freezer, fridge, ice pack, wide-mouth containers, infection-fighting factors, mother, baby, spoken tutorial, video tutorial",47177,4,2019-07-29 11:25:07,2019-07-31 07:16:02,,6,1498132
1211,1324,Basic-Post-Processing-using-ParaView-Slides.zip,1479,4,Basic-Post-Processing-using-ParaView-Codefiles.zip,2149126,4,"",2149126,6,263,2149126,4,"velocity vectors, stream lines, slice, clip, paraview, spoken tutorial",2149126,4,2019-07-29 15:16:44,2019-08-27 11:43:59,,6,2149126
