id,tutorial_detail_id,slide,slide_user_id,slide_status,code,code_user_id,code_status,assignment,assignment_user_id,assignment_status,prerequisite_id,prerequisite_user_id,prerequisite_status,keyword,keyword_user_id,keyword_status,created,updated,additional_material,additional_material_status,additional_material_user_id
732,739,Perl-and-HTML-Slides.zip,36848,4,Perl-and-HTML-Codefiles.zip,7,4,Perl-and-HTML-Assignment.txt,36848,4,738,36848,4,"cgi script, common gateway interface, html, perl cgi, perl programming, video tutorial",7,4,2015-12-23 11:47:37,2020-04-21 13:27:31,,6,36848
733,731,Conductivity-of-ionic-solutions-Slides.zip,3900,4,"",3900,6,Conductivity-of-ionic-solutions-Assignment.txt,3900,4,682,3900,4,"conductivity, ionic solutions, resistance of solutions, phase difference, expeyes junior, expeyes, video tutorial",7,4,2015-12-30 09:31:19,2020-04-21 11:40:51,,6,3900
734,742,Build-molecules-Slides.zip,4917,4,Build-molecules-Codefiles.zip,4917,4,Build-molecules-Assignment.txt,4917,4,,4917,6,"avogadro, build molecules, geometry optimization, insert fragments, set up force field, insert dna and  peptides, video tutorial",7,4,2015-12-31 05:54:16,2020-04-21 11:15:05,,6,4917
735,743,Edit-molecules-Slides.zip,456206,4,"",456206,6,Edit-molecules-Assignment.txt,456206,4,742,456206,4,"avogadro, build menu, fragment library, draw tool, bond centric manipulation tool, label atoms, video tutorial",7,4,2016-01-08 10:14:10,2020-04-21 11:16:03,,6,456206
736,745,Picking-and-Selection-Slides.zip,14794,4,Picking-and-Selection-Codefiles.zip,14794,4,Picking-and-Selection-Assignment.txt,14794,4,736,14794,4,"modify display, color residues, select atoms, select bonds, rotate bonds, change atoms, picking from screen, video tutorial, chimera tutorial.",14794,4,2016-01-25 06:18:27,2016-02-10 06:26:57,,6,14794
737,686,Formatting-article-in-Joomla-Slides.zip,36848,4,"",7943,6,Formatting-article-in-Joomla-Assignment.txt,7943,4,608,7943,4,"joomla, video tutorial, format article in joomla, lists in joomla, read more link in joomla article, insert horizontal line in joomla article, page break in joomla article, joomla article editor",7,4,2016-02-01 09:17:16,2020-04-21 12:31:25,,6,36848
738,595,Overview-of-OpenModelica-Slides.zip,3900,4,"",3900,6,"",3900,6,,3900,6,"OpenModelica, video tutorial",7,4,2016-02-03 09:21:21,2018-08-16 17:06:06,,6,3900
739,596,Developing-an-equation-based-model-Slides.zip,3900,4,Developing-an-equation-based-model-Codefiles.zip,3900,4,Developing-an-equation-based-model-Assignment.txt,3900,4,862,3900,4,"omedit, modelica, textual modeling in omedit, modelica class, model definition in modelica, libraries browser, variables browser, data-types in modelica, variable declaration in modelica, start and unit attributes, max and min attributes, equations in modelica, derivative in modelica, initial equation, model simulation, simulation setup toolbox, comments, video tutorial",7,4,2016-02-03 09:22:56,2018-04-22 02:21:29,,6,3900
740,597,Control-flow-and-Event-handling-Slides.zip,3900,4,Control-flow-and-Event-handling-Codefiles.zip,7,4,Control-flow-and-Event-handling-Assignment.txt,7,4,596,3900,4,"omedit, modelica, initial equation, if else statement in modelica, when statement in modelica, time event in modelica, state event in modelica, bouncing ball simulation in modelica, pre operator, reinit operator, video tutorial",7,4,2016-02-03 09:23:26,2020-04-21 13:22:41,,6,3900
741,746,Categories-in-Joomla-Slides.zip,36848,4,"",7943,6,Categories-in-Joomla-Assignment.txt,7943,4,686,7943,4,"creating category, video tutorial, category manager, edit category, assign articles to category, category, subcategory, unpublish a category, delete a category, trash a category, batch process, difference between delete and unpublish, copy an article from one category to another, move an article from one category to another, joomla",7,4,2016-02-04 05:14:32,2020-04-21 12:32:49,,6,36848
742,747,Menus-in-Joomla-Slides.zip,7943,4,"",7943,6,Menus-in-Joomla-Assignment.txt,7943,4,746,7943,4,"menu, video tutorial, menu manager, menu item, sub-menu, unpublish menu item, delete menu item, change the default homepage, menu item type, single item menu type, list of categories, menu item type, joomla",7,4,2016-02-05 06:13:56,2020-04-21 12:33:47,,6,7943
743,685,"",7,0,"",7,0,"",7,0,,7,0,video tutorial,7,0,2016-02-08 16:23:32,2016-02-08 16:23:32,,6,7
744,748,Functions-and-Types-Slides.zip,3900,4,Functions-and-Types-Codefiles.zip,3900,4,Functions-and-Types-Assignment.txt,3900,4,597,3900,4,"openmodelica, modelica, video tutorial, functions, input and output variables, algorithm, assignment statement, user types, protected parameters, restrictions on modelica, functions, start and unit attributes",7,4,2016-02-16 05:57:56,2020-04-21 13:23:47,,6,3900
745,749,Arrays-in-Modelica-Slides.zip,3900,4,Arrays-in-Modelica-Codefiles.zip,3900,4,Arrays-in-Modelica-Assignment.txt,7,4,748,3900,4,"openmodelica, modelica, vector declaration, vector assignment, array declaration, array indexing, for loop, while loop, video tutorial",7,4,2016-02-16 06:31:34,2019-07-10 13:44:39,,6,3900
746,751,Modelica-Packages-Slides.zip,3900,4,Modelica-Packages-Codefiles.zip,7,4,Modelica-Packages-Assignment.txt,3900,4,748,3900,4,"openmodelica, modelica, package, single file storage, directory storage, import, modelica library, video tutorial",7,4,2016-02-16 06:41:20,2019-10-30 06:56:27,,6,3900
747,752,Annotations--in-Modelica-Slides.zip,3900,4,Annotations--in-Modelica-Codefiles.zip,3900,4,Annotations--in-Modelica-Assignment.txt,3900,4,596,3900,4,"openmodelica, modelica, annotations, simulation setup, starttime, stoptime, experiment annotation, documentation annotation, tolerance, video tutorial",7,4,2016-02-16 06:51:34,2017-04-10 10:07:36,,6,3900
748,757,Create-Surfaces-Slides.zip,456206,4,"",456206,6,Create-Surfaces-Assignment.txt,456206,4,743,456206,4,"avogadro, surfaces, electrostatic potential surface, van der waal's surface, label atoms, partial charge, spoken tutorial, video tutorial",7,4,2016-02-17 07:22:39,2020-04-21 11:15:31,,6,456206
749,758,Setup-in-FA-Slides.zip,36848,4,"",47517,6,Setup-in-FA-Assignment.txt,47517,4,948,47517,4,"setup, company setup, user access, fiscal year, display setup, video tutorial",7,4,2016-02-18 10:57:09,2017-09-07 03:53:42,,6,36848
750,759,Banking-and-General-Ledger-Slides.zip,36848,4,Banking-and-General-Ledger-Codefiles.zip,47517,4,Banking-and-General-Ledger-Assignment.txt,36848,4,758,47517,4,"gl classes, groups, accounts, journal entry,  payment, deposit, balance sheet, video tutorial",7,4,2016-02-19 06:54:06,2017-09-07 03:53:51,,6,36848
751,760,Writing-Commands-Slides.zip,14794,4,"",14794,6,Writing-Commands-Assignment.txt,14794,4,745,14794,4,"chimera commands, change display, label residues, save image, remove solvent, change color, hide ribbons, video tutorial, chimera tutorial.",14794,4,2016-02-23 10:45:49,2016-02-24 10:05:28,,6,14794
752,774,Warli-art-for-Textle-design-Slides.zip,4595,4,Warli-art-for-Textle-design-Codefiles.zip,4595,4,Warli-art-for-Textle-design-Assignment.txt,4595,4,717,4595,4,"- inkscape, warli art in inkscape, repeat patterns using cloning, adjust cloning parameters in inkscapeapplication of the warli art in kurti, cloth bag etc, video tutorial",4595,4,2016-03-01 13:28:35,2016-05-03 04:02:58,,6,4595
753,775,Mango-pattern-for-Textile-design-Slides.zip,4595,4,Mango-pattern-for-Textile-design-Codefiles.zip,4595,4,Mango-pattern-for-Textile-design-Assignment.txt,4595,4,774,4595,4,"textile pattern for inkscape, mango pattern for textile design, draw using pattern along path, cloning in inkscape, inkscape, video tutorial",7,4,2016-03-01 13:31:28,2016-06-03 12:34:08,,6,4595
754,776,Static-Variables-Slides.zip,1333,4,Static-Variables-Codefiles.zip,1333,4,Static-Variables-Assignment.txt,7,4,741,1333,4,"static variables, class variables, instance variables, static keyword, final keyword, static constants, video tutorial",1333,4,2016-03-02 10:59:30,2019-12-03 09:39:02,,6,1333
755,750,Array-Functions-and-Operations-Slides.zip,3900,4,Array-Functions-and-Operations-Codefiles.zip,3900,4,Array-Functions-and-Operations-Assignment.txt,3900,4,749,3900,4,"omshell, modelica, arrays, array functions, identity, simulate, plot, min-max, ndims, video tutorial",7,4,2016-03-08 05:28:29,2017-04-10 10:08:24,,6,3900
756,753,Icon-and-Diagram-Views-Slides.zip,3900,4,Icon-and-Diagram-Views-Codefiles.zip,3900,4,Icon-and-Diagram-Views-Assignment.txt,3900,4,752,3900,4,"openmodelica, modelica, icon view, diagram view, icon annotation, diagram annotation, coordinate system, extent, grid, originx, originy, extent1x, extent1y, graphics, linecolor, fillcolor, linepattern, fillpattern, ellipse, video tutorial",7,4,2016-03-10 05:26:32,2017-04-10 10:12:02,,6,3900
757,754,Component-oriented-modeling-Slides.zip,3900,4,Component-oriented-modeling-Codefiles.zip,3900,4,Component-oriented-modeling-Assignment.txt,3900,4,753,3900,4,"openmodelica, modelica, class instantiation, component orientation, connectors, package, import, diagram view, connector, icon view, electric circuit, video tutorial",7,4,2016-03-10 05:28:27,2017-04-10 10:10:15,,6,3900
758,761,Hydrogen-Bonding-Slides.zip,4917,4,Hydrogen-Bonding-Codefiles.zip,4917,4,Hydrogen-Bonding-Assignment.txt,4917,4,743,4917,4,"avogadro,  configure avogadro, hydrogen bonding, force display type, dipole moment, video tutorial",7,4,2016-03-10 11:21:12,2020-04-21 11:17:09,,6,4917
759,762,Stereoisomerism-Slides.zip,4917,4,Stereoisomerism-Codefiles.zip,4917,4,Stereoisomerism-Assignment.txt,4917,4,761,4917,4,"avogadro, stereoisomerism, conformations, geometrical isomerism, r s configurations, priority rules, video tutorial",7,4,2016-03-10 11:22:10,2020-04-21 11:18:00,,6,4917
760,778,Surface-Properties-Slides.zip,14794,4,Surface-Properties-Codefiles.zip,14794,4,Surface-Properties-Assignment.txt,14794,4,760,14794,4,"protein surface, electrostatic potential surface, amino acid hydrophobicity, coulombic surface coloring, biomolecular recognition, drug binding cavities, chimera tutorial, video tutorial.",14794,4,2016-03-11 05:09:46,2016-03-15 05:45:49,,6,14794
761,777,Hosting-Git-Repositories-Slides.zip,1333,4,Hosting-Git-Repositories-Codefiles.zip,1333,4,Hosting-Git-Repositories-Assignment.txt,1333,4,706,1333,4,"video tutorial, git, git repository hosting services, github, repository, creating repository, adding files, commits, releases, creating branches, creating tags",1333,4,2016-03-14 04:56:09,2018-01-01 07:26:00,,6,1333
762,756,Block-Component-Modeling-Slides.zip,3900,4,Block-Component-Modeling-Codefiles.zip,7,4,Block-Component-Modeling-Assignment.txt,3900,4,754,3900,4,"openmodelica, modelica, modelica library, blocks, connectors, so, mo, siso, mimo, arithmetic operations using blocks, video tutorial",7,4,2016-04-04 02:28:15,2019-07-10 13:43:16,,6,3900
763,755,"",3900,0,"",3900,0,"",3900,0,,3900,0,video tutorial,3900,0,2016-04-04 10:35:15,2016-04-04 10:35:15,,6,3900
764,763,Overview-of-Biogas-Plant-series-Slides.zip,47177,4,"",47177,6,"",47177,6,,47177,6,"biogas, biogas plant, mixing tank, slurry tank, digester tank, generation of biogas, benefits of using biogas, finance options for the construction, masons, video tutorial",7,4,2016-04-22 06:07:52,2017-04-10 09:54:11,,6,47177
765,766,Finance-options-for-Biogas-plant-Slides.zip,47177,4,Finance-options-for-Biogas-plant-Codefiles.zip,47177,4,"",47177,6,765,47177,4,"biogas plant, cost factors, break-up of the budget, financial help available for building biogas plant, loan application form, government subsidies, self-finance, khadi and village industries commision (kvic) office, video tutorial",7,4,2016-04-25 09:43:42,2017-04-10 09:52:34,,6,47177
766,771,Construction-of-the-Mixing-tank-Slides.zip,47177,4,"",47177,6,"",47177,6,769,47177,4,"biogas, biogas plant, mixing tank, curing time, plastering the inner walls, plastering the outer walls, video tutorial",7,4,2016-04-26 06:58:04,2017-04-10 09:51:58,,6,47177
767,773,Maintenance-and-Repair-Slides.zip,47177,4,"",47177,6,"",47177,6,772,7,4,"biogas plant, repair, maintenance, bio-waste, burner, hose pipe, water condensation, slurry, water, plant waste,  inflammable items, flame, debris, video tutorial",7,4,2016-04-26 07:23:55,2017-04-10 09:53:42,,6,47177
768,764,Benefits-of-Biogas-Slides.zip,47177,4,"",47177,6,"",47177,6,763,47177,4,"generation of biogas, biogas plant, uses of biogas for cooking,  firewood, vohj clip, blow air, dry scrubbing pad, video tutorial",7,4,2016-04-26 07:31:34,2017-04-10 09:50:48,,6,47177
769,765,Generation-of-Biogas-Slides.zip,47177,4,Generation-of-Biogas-Codefiles.zip,47177,4,"",47177,6,764,47177,4,"when to add raw material to biogas plant, quantity of raw material to be added to biogas plant, use of slurry generated from the biogas plant, biogas burners and its connection process, biogas plant, video tutorial
",7,4,2016-04-26 10:49:08,2017-04-10 09:52:53,,6,47177
770,768,Laying-the-foundation-Slides.zip,47177,4,"",47177,6,"",47177,6,767,47177,4,"biogas plant, digging the pit, digester tank, slurry tank, sand, cement, gravel required for biogas plant, video tutorial
",7,4,2016-04-27 10:29:39,2017-04-10 09:53:28,,6,47177
771,772,Assembly-of-the-Biogas-plant-Slides.zip,47177,4,"",47177,6,"",47177,6,770,47177,4,"biogas plant, slurry tank, dome, mixing tank, sand, cement, steel rods, chicken mesh, video tutorial
",7,4,2016-04-27 11:50:28,2017-04-10 09:49:59,,6,47177
772,769,Construction-of-the-Dome-Slides.zip,47177,4,"",47177,6,"",47177,6,768,47177,4,"biogas plant, digester tank, cement, bamboo sticks, steel scale with two hooves, chicken mesh, metal hook, steel wire, video tutorial

",7,4,2016-04-27 12:05:25,2017-04-10 09:51:32,,6,47177
773,770,Building-the-walls-of-the-Slurry-tank-Slides.zip,47177,4,"",47177,6,"",47177,6,769,47177,4,"biogas plant, slurry tank, sand + cement + liquid waterproofing material mixture for the slurry tank, steel rods + chicken mesh entwining for the slurry tank, slurry tank, video tutorial",7,4,2016-04-27 12:21:45,2017-04-10 09:51:19,,6,47177
774,767,Material-required-to-construct-a-Biogas-plant-Slides.zip,47177,4,"",47177,6,"",47177,6,766,47177,4," biogas, biogas plant, material required, gravel, brass, weldmesh sheet, chicken mesh, site, number of days, best time, hardware & cement shop, video tutorial",7,4,2016-04-27 12:54:12,2017-04-10 09:54:00,,6,47177
775,779,File-Extensions-Slides.zip,14794,4,File-Extensions-Codefiles.zip,14794,4,File-Extensions-Assignment.txt,14794,4,762,14794,4,"computational chemistry, gamess input files, gaussian input files, molecular orbitals, calculated ir spectrum, avogadro tutorial, video tutorial",14794,4,2016-05-02 12:14:05,2016-05-06 09:06:01,,6,14794
776,780,Installing-and-Running-PyFoam-Slides.zip,2602,4,"",2602,6,"",2602,6,378,2602,4,"openfoam, pyfoam, pip, pyfoam installation, python, gnuplot, video tutorial",2602,4,2016-05-03 09:00:38,2019-06-13 06:31:44,,6,2602
777,785,Configuration-Management-in-Admin-Interface-Slides.zip,1333,4,"",1333,6,Configuration-Management-in-Admin-Interface-Assignment.txt,1333,4,784,1333,4,"video tutorial, drupal, extend, configuration, people, report,  permissions, roles, status reports, administration toolbar, help",1333,4,2016-06-02 06:44:15,2016-07-14 02:09:45,,6,1333
778,783,Overview-of-Drupal-Slides.zip,1333,4,"",1333,6,"",1333,6,,1333,6,"video tutorial, drupal, overview, cms, framework, features of drupal, drupal community",1333,4,2016-06-02 06:45:11,2016-08-03 06:01:20,,6,1333
779,805,General-Features-in-Avogadro-Slides.zip,4917,4,General-Features-in-Avogadro-Codefiles.zip,4917,4,General-Features-in-Avogadro-Assignment.txt,4917,4,742,4917,4,"ph, miller indices, crystals structures, super cell builder, polygon and ring display types, geometries in coordination compounds, nanotubes, avogadro, video tutorial",7,4,2016-06-13 06:42:29,2020-04-21 11:16:43,,6,4917
780,781,Structure-Analysis-Slides.zip,14794,4,Structure-Analysis-Codefiles.zip,14794,4,Structure-Analysis-Assignment.txt,14794,4,778,14794,4,"non-polar interactions, hydrogen bonds, rotamers, conformers, squalene synthase, chimera video tutorial.",14794,4,2016-06-22 05:40:51,2016-07-01 11:28:29,,6,14794
781,782,Superimposing-and-Morphing-Slides.zip,14794,4,Superimposing-and-Morphing-Codefiles.zip,14794,4,Superimposing-and-Morphing-Assignment.txt,14794,4,781,14794,4,"superimposing, morphing, conformations, trajectory, molecular dynamics, match-align tool, match-maker tool,  movie, chimera tutorial, video tutorial.",14794,4,2016-06-22 11:11:42,2016-07-01 11:36:54,,6,14794
782,784,Content-Management-in-Admin-Interface-Slides.zip,1333,4,Content-Management-in-Admin-Interface-Codefiles.zip,1333,4,Content-Management-in-Admin-Interface-Assignment.txt,1333,4,247,1333,4,"video tutorial, drupal, drupal interface, content, structure, appearance",1333,4,2016-06-23 06:24:03,2016-07-14 02:13:32,,6,1333
783,786,Creating-Basic-Content-Slides.zip,1333,4,"",1333,6,Creating-Basic-Content-Assignment.txt,1333,4,785,1333,4,"video tutorial, content type, node, creating article, article content type, text format,teaser mode,  basic html,  full html, restricted html, wysiwyg editor",1333,4,2016-06-30 05:30:03,2016-08-03 06:04:02,,6,1333
784,787,Editing-Existing-Content-Slides.zip,1333,4,"",1333,6,Editing-Existing-Content-Assignment.txt,1333,4,786,1333,4,"video tutorial, drupal, inline editing, configure the block, quick edit, edit your image, edit your tags, ckeditor, wysiwyg editor",7,4,2016-06-30 05:35:44,2020-04-21 11:31:18,,6,1333
785,788,Creating-New-Content-Types-Slides.zip,1333,4,"",1333,6,Creating-New-Content-Types-Assignment.txt,1333,4,787,1333,4,"video tutorial, drupal, creating new content, adding fields, events content type, user group content type",7,4,2016-06-30 05:47:27,2020-04-21 11:31:49,,6,1333
786,789,User-group-and-Entity-Reference-Slides.zip,1333,4,"",1333,6,User-group-and-Entity-Reference-Assignment.txt,1333,4,788,1333,4,"video tutorial, drupal, new revision, label, entity reference, database, impact, reference, sponsored, theoretically, many to many relationship",7,4,2016-06-30 05:53:53,2020-04-21 11:32:05,,6,1333
787,790,Taxonomy-Slides.zip,1333,4,"",1333,6,Taxonomy-Assignment.txt,1333,4,789,1333,4,"video tutorial, drupal, taxonomy, categories, adding a taxonomy, vocabulary",1333,4,2016-06-30 07:03:26,2016-07-26 12:36:57,,6,1333
788,791,Managing-Content-Slides.zip,1333,4,"",1333,6,Managing-Content-Assignment.txt,1333,4,790,1333,4,"ideo tutorial, drupal,  creating content, events, user groups, managing content, comments, files, revisions, video tutorial",7,4,2016-06-30 07:12:51,2017-04-10 09:59:24,,6,1333
789,792,Creating-Dummy-Content-Slides.zip,1333,4,Creating-Dummy-Content-Codefiles.zip,1333,4,Creating-Dummy-Content-Assignment.txt,1333,4,791,1333,4,"video tutorial, drupal,  devel, dummy content",1333,4,2016-06-30 07:26:57,2016-07-22 13:17:53,,6,1333
790,794,Displaying-Contents-using-Views-Slides.zip,1333,4,"",1333,6,Displaying-Contents-using-Views-Assignment.txt,1333,4,793,1333,4,"drupal, video tutorial, views, page, teasers, block view, recently added events",1333,4,2016-06-30 14:22:37,2016-07-26 12:37:07,,6,1333
791,793,Modifying-the-Display-of-Content-Slides.zip,1333,4,"",1333,6,Modifying-the-Display-of-Content-Assignment.txt,1333,4,792,1333,4,"video tutorial, drupal, full content layout, teaser layout, default layout, custom display settings, full content, manage display, full content view, managing the teaser display, teaser mode",1333,4,2016-06-30 14:34:30,2016-07-26 12:37:25,,6,1333
792,795,Table-of-Fields-with-Views-Slides.zip,1333,4,"",1333,6,Table-of-Fields-with-Views-Assignment.txt,1333,4,794,1333,4,"drupal, video tutorial, table, fields, table view, sort, events",1333,4,2016-07-04 04:40:53,2016-07-26 12:37:37,,6,1333
793,806,Report-Writing-Slides.zip,8,4,Report-Writing-Codefiles.zip,7,4,Report-Writing-Assignment.pdf,7,4,519,8,4,"LaTeX tutorial, Video tutorial, report style, article style, font size, a4 paper, a5 paper, geometry package, table of contents, chapter, section, subsection, subsubsection, two pass compilation, automatic sectioning, automatic numbering, appendix",7,4,2016-07-04 08:39:11,2019-12-17 11:24:42,,6,7
794,807,Items-and-Inventory-Slides.zip,47517,4,"",47517,6,Items-and-Inventory-Assignment.txt,47517,4,759,47517,4,"items, inventory, units of measure, item category, sales pricing, video tutorial",7,4,2016-07-08 07:29:25,2019-05-13 06:08:49,,6,47517
795,808,Sales-in-FA-Slides.zip,47517,4,"",47517,6,Sales-in-FA-Assignment.txt,47517,4,807,47517,4,"sales types, sales persons, sales areas, add and manage customers, sales quotation entry, sales order entry, make delivery, sales order inquiry, video tutorial",7,4,2016-07-11 12:29:08,2017-04-10 10:30:05,,6,47517
796,796,Controlling-Display-of-Images-Slides.zip,1333,4,"",1333,6,Controlling-Display-of-Images-Assignment.txt,1333,4,795,1333,4,"video tutorial, drupal, media, image styles, scales and sizes, grid, effect, event logo, grid layout, display, format, fields, filter, sort",1333,4,2016-07-13 09:17:40,2016-07-21 12:50:27,,6,1333
797,797,Adding-Functionalities-using-Modules-Slides.zip,1333,4,"",1333,6,Adding-Functionalities-using-Modules-Assignment.txt,1333,4,796,1333,4,"video tutorial, drupal, core module, contribute module, custom module, book module, forum module, book outline, navigation, blocks, forum topic, comments",7,4,2016-07-13 09:46:31,2020-04-21 11:32:27,,6,1333
798,798,Finding-and-Evaluating-Modules-Slides.zip,1333,4,"",1333,6,Finding-and-Evaluating-Modules-Assignment.txt,1333,4,797,1333,4,"drupal, dmv, finding and evaluating modules, video tutorial",7,4,2016-07-13 10:39:12,2017-04-10 09:59:11,,6,1333
799,799,Modifying-the-Page-Layout-Slides.zip,1333,4,"",1333,6,Modifying-the-Page-Layout-Assignment.txt,1333,4,798,1333,4,"video tutorial, drupal, layout, themes, blocks, menus, block regions, block configuration, permissions, removing blocks, re-ordering blocks",1333,4,2016-07-15 07:15:20,2016-07-21 12:50:39,,6,1333
800,801,Styling-a-Page-using-Themes-Slides.zip,1333,4,Styling-a-Page-using-Themes-Codefiles.zip,1333,4,Styling-a-Page-using-Themes-Assignment.txt,1333,4,800,1333,4,"drupal, video tutorial, themes, contributed themes, starter themes, base themes, sub-themes, zircon theme",1333,4,2016-07-15 07:26:28,2016-07-22 10:20:15,,6,1333
801,800,Menu-and-Endpoints-Slides.zip,1333,4,Menu-and-Endpoints-Codefiles.zip,1333,4,Menu-and-Endpoints-Assignment.txt,1333,4,799,1333,4,"drupal, video tutorial, url paths, pathauto, token, ctools, menu management, endpoints, creating menu links, creating aliases",1333,4,2016-07-15 07:32:10,2016-07-22 10:20:25,,6,1333
802,802,Installing-an-Advanced-Theme-Slides.zip,1333,4,Installing-an-Advanced-Theme-Codefiles.zip,1333,4,Installing-an-Advanced-Theme-Assignment.txt,1333,4,801,1333,4,"drupal, video tutorial, themes, contributed themes, advanced themes, zircon theme, adaptive theme, pixture reloaded theme",1333,4,2016-07-15 08:52:09,2016-07-22 10:20:35,,6,1333
803,803,People-Management-Slides.zip,1333,4,People-Management-Codefiles.zip,1333,4,People-Management-Assignment.txt,1333,4,802,1333,4,"drupal, video tutorial, people management, super user, adding role, masquerade module, testing permissions",1333,4,2016-07-15 10:02:27,2016-07-22 10:20:49,,6,1333
804,804,Drupal-Site-Management-Slides.zip,1333,4,Drupal-Site-Management-Codefiles.zip,1333,4,"",1333,6,803,1333,4,"drupal, video tutorial, reports, help, site management, update, modules and themes, back up",7,4,2016-07-19 05:56:58,2020-04-21 11:32:58,,6,1333
805,810,Introduction-to-Arduino-Slides.zip,36848,4,"",36848,6,"",36848,6,,36848,6,"arduino installation, arduino, microcontroller, arduino ide, video tutorial",7,4,2016-07-29 10:21:38,2020-04-21 11:12:13,,6,36848
806,809,Introduction-to-gedit-Text-Editor-Slides.zip,36848,4,Introduction-to-gedit-Text-Editor-Codefiles.zip,36848,4,Introduction-to-gedit-Text-Editor-Assignment.txt,36848,4,109,36848,4,"gedit text editor, gedit installation, open a file, save a file, close a file, video tutorial, menu bar, toolbar, typing text in gedit, quit gedit, gedit",7,4,2016-07-29 10:51:28,2020-04-21 11:51:32,,6,36848
807,811,Bouncing-ball-animation-Slides.zip,4595,4,"",4595,6,Bouncing-ball-animation-Assignment.txt,4595,4,,4595,6,"synfig interface, rename layers, draw basic shapes and fill color using parameters, animate a ball using squash effect, add key frames and way points, render output in gif format, spoken tutorial, video tutorial",7,4,2016-07-29 11:04:30,2020-04-21 13:32:03,,6,4595
809,813,Attributes-Slides.zip,14794,4,Attributes-Codefiles.zip,14794,4,Attributes-Assignment.txt,14794,4,782,14794,4,"attributes of atoms, attributes of residues, b-factor, kdhydrophobicity scale , chimera video tutorial, spoken tutorial.",14794,4,2016-08-08 07:25:37,2016-09-09 11:41:16,,6,14794
811,818,Common-Edit-Functions-Slides.zip,36848,4,Common-Edit-Functions-Codefiles.zip,36848,4,Common-Edit-Functions-Assignment.txt,36848,4,809,36848,4,"cut, copy, paste, undo, redo, search, replace, print, gedit, gedit text editor, video tutorial",7,4,2016-08-10 10:00:23,2020-04-21 11:50:11,,6,36848
812,812,Build-Structures-Slides.zip,14794,4,"",14794,6,Build-Structures-Assignment.txt,14794,4,778,14794,4,"build structures, add atoms, delete atoms, minimize energy, join models, chimera tutorial, video tutorial",14794,4,2016-08-11 09:56:14,2016-08-18 12:21:06,,6,14794
